{
  "id": "festival-t3-gengar",
  "theme": "festival",
  "difficulty": 3,
  "canvas": {
    "w": 3200,
    "h": 1000
  },
  "target": {
    "species": 94,
    "x": 1600,
    "y": 820,
    "scale": 130,
    "bbox": [
      1535,
      755,
      130,
      130
    ],
    "occlusion_pct": 0.0
  },
  "decoys": [
    {
      "species": 92,
      "x": 1450,
      "y": 790,
      "scale": 110
    },
    {
      "species": 92,
      "x": 1750,
      "y": 840,
      "scale": 100
    },
    {
      "species": 197,
      "x": 1520,
      "y": 860,
      "scale": 140
    },
    {
      "species": 150,
      "x": 1680,
      "y": 760,
      "scale": 160
    }
  ],
  "entities": [
    {
      "asset_id": "prop:ferris-wheel",
      "type": "prop",
      "x": 2800,
      "y": 300,
      "z_layer": 0,
      "scale": 350
    },
    {
      "asset_id": "prop:lamppost",
      "type": "prop",
      "x": 300,
      "y": 350,
      "z_layer": 0,
      "scale": 250
    },
    {
      "asset_id": "prop:stall-red",
      "type": "prop",
      "x": 600,
      "y": 520,
      "z_layer": 1,
      "scale": 200
    },
    {
      "asset_id": "prop:stall-blue",
      "type": "prop",
      "x": 2400,
      "y": 530,
      "z_layer": 1,
      "scale": 210
    },
    {
      "asset_id": "prop:balloon-cluster",
      "type": "prop",
      "x": 1000,
      "y": 650,
      "z_layer": 1,
      "scale": 150
    },
    {
      "asset_id": "prop:balloon-cluster",
      "type": "prop",
      "x": 2000,
      "y": 640,
      "z_layer": 1,
      "scale": 160
    },
    {
      "asset_id": "prop:tent",
      "type": "prop",
      "x": 400,
      "y": 480,
      "z_layer": 1,
      "scale": 280
    },
    {
      "asset_id": "prop:tent",
      "type": "prop",
      "x": 2600,
      "y": 490,
      "z_layer": 1,
      "scale": 290
    },
    {
      "asset_id": "npc:vendor",
      "type": "npc",
      "x": 580,
      "y": 680,
      "z_layer": 2,
      "scale": 140
    },
    {
      "asset_id": "npc:vendor",
      "type": "npc",
      "x": 2420,
      "y": 690,
      "z_layer": 2,
      "scale": 145
    },
    {
      "asset_id": "npc:villager-a",
      "type": "npc",
      "x": 150,
      "y": 720,
      "z_layer": 2,
      "scale": 130
    },
    {
      "asset_id": "npc:villager-b",
      "type": "npc",
      "x": 3100,
      "y": 730,
      "z_layer": 2,
      "scale": 135
    },
    {
      "asset_id": "npc:trainer",
      "type": "npc",
      "x": 1200,
      "y": 710,
      "z_layer": 2,
      "scale": 150
    },
    {
      "asset_id": "npc:trainer",
      "type": "npc",
      "x": 2000,
      "y": 720,
      "z_layer": 2,
      "scale": 145
    },
    {
      "asset_id": "pokemon:25",
      "type": "pokemon",
      "x": 800,
      "y": 850,
      "z_layer": 2,
      "scale": 120
    },
    {
      "asset_id": "pokemon:25",
      "type": "pokemon",
      "x": 2200,
      "y": 860,
      "z_layer": 2,
      "scale": 115
    },
    {
      "asset_id": "pokemon:133",
      "type": "pokemon",
      "x": 100,
      "y": 840,
      "z_layer": 2,
      "scale": 110
    },
    {
      "asset_id": "pokemon:133",
      "type": "pokemon",
      "x": 3050,
      "y": 850,
      "z_layer": 2,
      "scale": 115
    },
    {
      "asset_id": "pokemon:172",
      "type": "pokemon",
      "x": 1300,
      "y": 800,
      "z_layer": 2,
      "scale": 100
    },
    {
      "asset_id": "pokemon:172",
      "type": "pokemon",
      "x": 1900,
      "y": 810,
      "z_layer": 2,
      "scale": 95
    },
    {
      "asset_id": "pokemon:58",
      "type": "pokemon",
      "x": 700,
      "y": 780,
      "z_layer": 2,
      "scale": 130
    },
    {
      "asset_id": "pokemon:58",
      "type": "pokemon",
      "x": 2300,
      "y": 790,
      "z_layer": 2,
      "scale": 125
    },
    {
      "asset_id": "pokemon:1",
      "type": "pokemon",
      "x": 1400,
      "y": 880,
      "z_layer": 2,
      "scale": 120
    },
    {
      "asset_id": "pokemon:43",
      "type": "pokemon",
      "x": 1800,
      "y": 890,
      "z_layer": 2,
      "scale": 110
    },
    {
      "asset_id": "npc:villager-c",
      "type": "npc",
      "x": 1050,
      "y": 760,
      "z_layer": 3,
      "scale": 140
    },
    {
      "asset_id": "npc:villager-d",
      "type": "npc",
      "x": 2150,
      "y": 770,
      "z_layer": 3,
      "scale": 145
    },
    {
      "asset_id": "prop:balloon-cluster",
      "type": "prop",
      "x": 1443.0,
      "y": 883.0,
      "z_layer": 4,
      "scale": 180
    }
  ],
  "hint_text": "Look near the red and blue balloons where the purple ghost hides!",
  "density": {
    "crowd": 23,
    "total": 32
  }
}
