{
  "id": "market-t3-charmander",
  "theme": "market",
  "difficulty": 3,
  "canvas": {
    "w": 3200,
    "h": 1000
  },
  "target": {
    "species": 4,
    "x": 1600,
    "y": 750,
    "scale": 110,
    "bbox": [
      1545,
      695,
      110,
      110
    ],
    "occlusion_pct": 8
  },
  "decoys": [
    {
      "species": 5,
      "x": 1350,
      "y": 700,
      "scale": 130
    },
    {
      "species": 77,
      "x": 1850,
      "y": 720,
      "scale": 160
    },
    {
      "species": 58,
      "x": 1550,
      "y": 840,
      "scale": 100
    },
    {
      "species": 6,
      "x": 1900,
      "y": 630,
      "scale": 200
    }
  ],
  "entities": [
    {
      "asset_id": "pokemon:16",
      "type": "pokemon",
      "x": 200,
      "y": 250,
      "z_layer": 0,
      "scale": 90
    },
    {
      "asset_id": "pokemon:12",
      "type": "pokemon",
      "x": 3000,
      "y": 220,
      "z_layer": 0,
      "scale": 100,
      "flip": true
    },
    {
      "asset_id": "prop:stall-red",
      "type": "prop",
      "x": 400,
      "y": 550,
      "z_layer": 1,
      "scale": 400
    },
    {
      "asset_id": "prop:stall-blue",
      "type": "prop",
      "x": 1100,
      "y": 580,
      "z_layer": 1,
      "scale": 380
    },
    {
      "asset_id": "prop:lamppost",
      "type": "prop",
      "x": 2200,
      "y": 450,
      "z_layer": 1,
      "scale": 250
    },
    {
      "asset_id": "prop:stall-red",
      "type": "prop",
      "x": 2800,
      "y": 600,
      "z_layer": 1,
      "scale": 350
    },
    {
      "asset_id": "npc:vendor",
      "type": "npc",
      "x": 450,
      "y": 680,
      "z_layer": 2,
      "scale": 140
    },
    {
      "asset_id": "pokemon:25",
      "type": "pokemon",
      "x": 600,
      "y": 750,
      "z_layer": 2,
      "scale": 110
    },
    {
      "asset_id": "npc:villager-a",
      "type": "npc",
      "x": 750,
      "y": 690,
      "z_layer": 2,
      "scale": 130
    },
    {
      "asset_id": "pokemon:1",
      "type": "pokemon",
      "x": 950,
      "y": 720,
      "z_layer": 2,
      "scale": 120
    },
    {
      "asset_id": "npc:vendor",
      "type": "npc",
      "x": 1250,
      "y": 680,
      "z_layer": 2,
      "scale": 140
    },
    {
      "asset_id": "pokemon:52",
      "type": "pokemon",
      "x": 1450,
      "y": 740,
      "z_layer": 2,
      "scale": 100
    },
    {
      "asset_id": "npc:villager-b",
      "type": "npc",
      "x": 1750,
      "y": 700,
      "z_layer": 2,
      "scale": 130
    },
    {
      "asset_id": "pokemon:35",
      "type": "pokemon",
      "x": 1950,
      "y": 760,
      "z_layer": 2,
      "scale": 110
    },
    {
      "asset_id": "npc:villager-c",
      "type": "npc",
      "x": 2100,
      "y": 690,
      "z_layer": 2,
      "scale": 130
    },
    {
      "asset_id": "pokemon:133",
      "type": "pokemon",
      "x": 2300,
      "y": 750,
      "z_layer": 2,
      "scale": 120
    },
    {
      "asset_id": "npc:trainer",
      "type": "npc",
      "x": 2500,
      "y": 710,
      "z_layer": 2,
      "scale": 140
    },
    {
      "asset_id": "pokemon:19",
      "type": "pokemon",
      "x": 2700,
      "y": 770,
      "z_layer": 2,
      "scale": 90
    },
    {
      "asset_id": "npc:villager-d",
      "type": "npc",
      "x": 2900,
      "y": 720,
      "z_layer": 2,
      "scale": 130
    },
    {
      "asset_id": "npc:vendor",
      "type": "npc",
      "x": 300,
      "y": 700,
      "z_layer": 3,
      "scale": 140,
      "flip": true
    },
    {
      "asset_id": "prop:crate",
      "type": "prop",
      "x": 1650,
      "y": 830,
      "z_layer": 3,
      "scale": 100
    },
    {
      "asset_id": "prop:barrel",
      "type": "prop",
      "x": 1400,
      "y": 840,
      "z_layer": 3,
      "scale": 90
    },
    {
      "asset_id": "prop:bench",
      "type": "prop",
      "x": 800,
      "y": 820,
      "z_layer": 3,
      "scale": 200
    },
    {
      "asset_id": "prop:crate",
      "type": "prop",
      "x": 2400,
      "y": 830,
      "z_layer": 3,
      "scale": 110
    },
    {
      "asset_id": "prop:barrel",
      "type": "prop",
      "x": 3050,
      "y": 810,
      "z_layer": 3,
      "scale": 90
    },
    {
      "asset_id": "prop:crate",
      "type": "prop",
      "x": 550,
      "y": 800,
      "z_layer": 3,
      "scale": 100
    }
  ],
  "hint_text": "Look near the red fruit stall in the middle of the square!",
  "math_hook": {
    "skill": "add",
    "max": 8
  }
}
