{
  "id": "beach-t3-lapras",
  "theme": "beach",
  "difficulty": 3,
  "canvas": {
    "w": 3200,
    "h": 1000
  },
  "target": {
    "species": 131,
    "x": 1600,
    "y": 480,
    "scale": 140,
    "bbox": [
      1530,
      410,
      140,
      140
    ],
    "occlusion_pct": 0.0
  },
  "decoys": [
    {
      "species": 87,
      "x": 1350,
      "y": 460,
      "scale": 130
    },
    {
      "species": 79,
      "x": 1480,
      "y": 510,
      "scale": 120
    },
    {
      "species": 130,
      "x": 1850,
      "y": 450,
      "scale": 160,
      "flip": true
    }
  ],
  "entities": [
    {
      "asset_id": "prop:boat-small",
      "type": "prop",
      "x": 400,
      "y": 420,
      "z_layer": 1,
      "scale": 280
    },
    {
      "asset_id": "prop:umbrella",
      "type": "prop",
      "x": 600,
      "y": 650,
      "z_layer": 1,
      "scale": 180
    },
    {
      "asset_id": "prop:sandcastle",
      "type": "prop",
      "x": 900,
      "y": 780,
      "z_layer": 2,
      "scale": 100
    },
    {
      "asset_id": "prop:boat-small",
      "type": "prop",
      "x": 2600,
      "y": 410,
      "z_layer": 1,
      "scale": 260
    },
    {
      "asset_id": "prop:bench",
      "type": "prop",
      "x": 2200,
      "y": 720,
      "z_layer": 1,
      "scale": 200
    },
    {
      "asset_id": "prop:rock",
      "type": "prop",
      "x": 2800,
      "y": 550,
      "z_layer": 1,
      "scale": 140
    },
    {
      "asset_id": "prop:umbrella",
      "type": "prop",
      "x": 1100,
      "y": 640,
      "z_layer": 1,
      "scale": 190
    },
    {
      "asset_id": "prop:sandcastle",
      "type": "prop",
      "x": 3100,
      "y": 820,
      "z_layer": 2,
      "scale": 110
    },
    {
      "asset_id": "prop:bench",
      "type": "prop",
      "x": 150,
      "y": 700,
      "z_layer": 1,
      "scale": 210
    },
    {
      "asset_id": "prop:rock",
      "type": "prop",
      "x": 1200,
      "y": 540,
      "z_layer": 2,
      "scale": 130
    },
    {
      "asset_id": "pokemon:92",
      "type": "pokemon",
      "x": 300,
      "y": 180,
      "z_layer": 0,
      "scale": 90
    },
    {
      "asset_id": "pokemon:16",
      "type": "pokemon",
      "x": 2900,
      "y": 190,
      "z_layer": 0,
      "scale": 100
    },
    {
      "asset_id": "pokemon:12",
      "type": "pokemon",
      "x": 1500,
      "y": 200,
      "z_layer": 0,
      "scale": 110,
      "flip": true
    },
    {
      "asset_id": "pokemon:130",
      "type": "pokemon",
      "x": 650,
      "y": 440,
      "z_layer": 1,
      "scale": 200
    },
    {
      "asset_id": "pokemon:87",
      "type": "pokemon",
      "x": 2700,
      "y": 450,
      "z_layer": 1,
      "scale": 190
    },
    {
      "asset_id": "pokemon:98",
      "type": "pokemon",
      "x": 500,
      "y": 580,
      "z_layer": 2,
      "scale": 100
    },
    {
      "asset_id": "pokemon:79",
      "type": "pokemon",
      "x": 2900,
      "y": 590,
      "z_layer": 2,
      "scale": 140
    },
    {
      "asset_id": "npc:fisher",
      "type": "npc",
      "x": 350,
      "y": 680,
      "z_layer": 2,
      "scale": 150
    },
    {
      "asset_id": "npc:vendor",
      "type": "npc",
      "x": 2400,
      "y": 700,
      "z_layer": 2,
      "scale": 160
    },
    {
      "asset_id": "pokemon:54",
      "type": "pokemon",
      "x": 800,
      "y": 720,
      "z_layer": 2,
      "scale": 120
    },
    {
      "asset_id": "pokemon:132",
      "type": "pokemon",
      "x": 2100,
      "y": 740,
      "z_layer": 2,
      "scale": 110,
      "flip": true
    },
    {
      "asset_id": "pokemon:25",
      "type": "pokemon",
      "x": 1300,
      "y": 800,
      "z_layer": 3,
      "scale": 100
    },
    {
      "asset_id": "pokemon:172",
      "type": "pokemon",
      "x": 1800,
      "y": 820,
      "z_layer": 3,
      "scale": 90
    },
    {
      "asset_id": "pokemon:39",
      "type": "pokemon",
      "x": 400,
      "y": 840,
      "z_layer": 3,
      "scale": 110
    },
    {
      "asset_id": "pokemon:43",
      "type": "pokemon",
      "x": 3000,
      "y": 860,
      "z_layer": 3,
      "scale": 105
    },
    {
      "asset_id": "npc:trainer",
      "type": "npc",
      "x": 1700,
      "y": 880,
      "z_layer": 3,
      "scale": 145
    },
    {
      "asset_id": "pokemon:1",
      "type": "pokemon",
      "x": 2300,
      "y": 900,
      "z_layer": 3,
      "scale": 120
    }
  ],
  "hint_text": "Look near the water's edge where the blue turtles swim!",
  "density": {
    "crowd": 21,
    "total": 31
  }
}
