{
  "id": "harbor-t3-magikarp",
  "theme": "harbor",
  "difficulty": 3,
  "canvas": {
    "w": 3200,
    "h": 1000
  },
  "target": {
    "species": 129,
    "x": 1450,
    "y": 580,
    "scale": 120,
    "bbox": [
      1390,
      520,
      120,
      120
    ],
    "occlusion_pct": 0.0
  },
  "decoys": [
    {
      "species": 116,
      "x": 1250,
      "y": 590,
      "scale": 110
    },
    {
      "species": 90,
      "x": 1620,
      "y": 560,
      "scale": 100,
      "flip": true
    },
    {
      "species": 120,
      "x": 1480,
      "y": 650,
      "scale": 115
    },
    {
      "species": 222,
      "x": 1700,
      "y": 595,
      "scale": 125
    }
  ],
  "entities": [
    {
      "asset_id": "prop:lighthouse",
      "type": "prop",
      "x": 2800,
      "y": 400,
      "z_layer": 1,
      "scale": 280
    },
    {
      "asset_id": "prop:boat-sail",
      "type": "prop",
      "x": 400,
      "y": 420,
      "z_layer": 1,
      "scale": 280
    },
    {
      "asset_id": "prop:boat-small",
      "type": "prop",
      "x": 1600,
      "y": 550,
      "z_layer": 1,
      "scale": 200
    },
    {
      "asset_id": "prop:boat-small",
      "type": "prop",
      "x": 800,
      "y": 530,
      "z_layer": 1,
      "scale": 190
    },
    {
      "asset_id": "prop:net",
      "type": "prop",
      "x": 2200,
      "y": 480,
      "z_layer": 1,
      "scale": 150
    },
    {
      "asset_id": "prop:crate",
      "type": "prop",
      "x": 500,
      "y": 850,
      "z_layer": 3,
      "scale": 120
    },
    {
      "asset_id": "prop:crate",
      "type": "prop",
      "x": 700,
      "y": 860,
      "z_layer": 3,
      "scale": 120
    },
    {
      "asset_id": "prop:barrel",
      "type": "prop",
      "x": 2600,
      "y": 920,
      "z_layer": 3,
      "scale": 100
    },
    {
      "asset_id": "prop:barrel",
      "type": "prop",
      "x": 1200,
      "y": 910,
      "z_layer": 3,
      "scale": 100
    },
    {
      "asset_id": "prop:bench",
      "type": "prop",
      "x": 3000,
      "y": 940,
      "z_layer": 3,
      "scale": 160
    },
    {
      "asset_id": "prop:lamppost",
      "type": "prop",
      "x": 200,
      "y": 750,
      "z_layer": 2,
      "scale": 180
    },
    {
      "asset_id": "pokemon:16",
      "type": "pokemon",
      "x": 300,
      "y": 250,
      "z_layer": 0,
      "scale": 90
    },
    {
      "asset_id": "pokemon:12",
      "type": "pokemon",
      "x": 2900,
      "y": 280,
      "z_layer": 0,
      "scale": 100,
      "flip": true
    },
    {
      "asset_id": "pokemon:130",
      "type": "pokemon",
      "x": 1000,
      "y": 480,
      "z_layer": 1,
      "scale": 250
    },
    {
      "asset_id": "pokemon:131",
      "type": "pokemon",
      "x": 2400,
      "y": 500,
      "z_layer": 1,
      "scale": 230,
      "flip": true
    },
    {
      "asset_id": "pokemon:90",
      "type": "pokemon",
      "x": 600,
      "y": 540,
      "z_layer": 1,
      "scale": 110
    },
    {
      "asset_id": "pokemon:116",
      "type": "pokemon",
      "x": 2100,
      "y": 510,
      "z_layer": 1,
      "scale": 120
    },
    {
      "asset_id": "npc:fisher",
      "type": "npc",
      "x": 450,
      "y": 720,
      "z_layer": 2,
      "scale": 150
    },
    {
      "asset_id": "npc:vendor",
      "type": "npc",
      "x": 2500,
      "y": 750,
      "z_layer": 2,
      "scale": 160
    },
    {
      "asset_id": "pokemon:54",
      "type": "pokemon",
      "x": 900,
      "y": 820,
      "z_layer": 2,
      "scale": 130
    },
    {
      "asset_id": "pokemon:25",
      "type": "pokemon",
      "x": 1300,
      "y": 880,
      "z_layer": 2,
      "scale": 120,
      "flip": true
    },
    {
      "asset_id": "pokemon:79",
      "type": "pokemon",
      "x": 2800,
      "y": 810,
      "z_layer": 2,
      "scale": 140
    },
    {
      "asset_id": "pokemon:98",
      "type": "pokemon",
      "x": 300,
      "y": 890,
      "z_layer": 3,
      "scale": 100
    },
    {
      "asset_id": "pokemon:183",
      "type": "pokemon",
      "x": 2200,
      "y": 860,
      "z_layer": 3,
      "scale": 110
    },
    {
      "asset_id": "npc:villager-a",
      "type": "npc",
      "x": 1600,
      "y": 730,
      "z_layer": 2,
      "scale": 150
    },
    {
      "asset_id": "npc:villager-b",
      "type": "npc",
      "x": 1800,
      "y": 740,
      "z_layer": 2,
      "scale": 145
    },
    {
      "asset_id": "pokemon:19",
      "type": "pokemon",
      "x": 2650,
      "y": 900,
      "z_layer": 3,
      "scale": 95
    }
  ],
  "hint_text": "Look near the boats by the wooden pier!",
  "density": {
    "crowd": 21,
    "total": 32
  },
  "math_hook": {
    "skill": "count",
    "max": 6
  }
}
