{
  "id": "harbor-t4-gyarados",
  "theme": "harbor",
  "difficulty": 4,
  "canvas": {
    "w": 3200,
    "h": 1000
  },
  "target": {
    "species": 130,
    "x": 1650,
    "y": 510,
    "scale": 160,
    "bbox": [
      1570,
      430,
      160,
      160
    ],
    "occlusion_pct": 0.0
  },
  "decoys": [
    {
      "species": 131,
      "x": 1480,
      "y": 520,
      "scale": 180
    },
    {
      "species": 147,
      "x": 1780,
      "y": 490,
      "scale": 120,
      "flip": true
    },
    {
      "species": 148,
      "x": 1350,
      "y": 540,
      "scale": 140
    },
    {
      "species": 882,
      "x": 1850,
      "y": 505,
      "scale": 150
    }
  ],
  "entities": [
    {
      "asset_id": "prop:lighthouse",
      "type": "prop",
      "x": 200,
      "y": 450,
      "z_layer": 0,
      "scale": 240
    },
    {
      "asset_id": "prop:boat-sail",
      "type": "prop",
      "x": 600,
      "y": 420,
      "z_layer": 1,
      "scale": 320
    },
    {
      "asset_id": "prop:boat-small",
      "type": "prop",
      "x": 900,
      "y": 550,
      "z_layer": 1,
      "scale": 180
    },
    {
      "asset_id": "prop:boat-small",
      "type": "prop",
      "x": 2400,
      "y": 540,
      "z_layer": 1,
      "scale": 190
    },
    {
      "asset_id": "pokemon:129",
      "type": "pokemon",
      "x": 120,
      "y": 530,
      "z_layer": 1,
      "scale": 100
    },
    {
      "asset_id": "pokemon:129",
      "type": "pokemon",
      "x": 750,
      "y": 520,
      "z_layer": 1,
      "scale": 110
    },
    {
      "asset_id": "pokemon:87",
      "type": "pokemon",
      "x": 2700,
      "y": 510,
      "z_layer": 1,
      "scale": 160
    },
    {
      "asset_id": "pokemon:54",
      "type": "pokemon",
      "x": 450,
      "y": 680,
      "z_layer": 2,
      "scale": 120
    },
    {
      "asset_id": "pokemon:79",
      "type": "pokemon",
      "x": 350,
      "y": 700,
      "z_layer": 2,
      "scale": 140
    },
    {
      "asset_id": "npc:fisher",
      "type": "npc",
      "x": 250,
      "y": 750,
      "z_layer": 2,
      "scale": 160
    },
    {
      "asset_id": "npc:villager-a",
      "type": "npc",
      "x": 550,
      "y": 780,
      "z_layer": 2,
      "scale": 150
    },
    {
      "asset_id": "pokemon:25",
      "type": "pokemon",
      "x": 650,
      "y": 760,
      "z_layer": 2,
      "scale": 100
    },
    {
      "asset_id": "npc:vendor",
      "type": "npc",
      "x": 1100,
      "y": 790,
      "z_layer": 2,
      "scale": 170
    },
    {
      "asset_id": "pokemon:16",
      "type": "pokemon",
      "x": 1050,
      "y": 650,
      "z_layer": 2,
      "scale": 110
    },
    {
      "asset_id": "pokemon:35",
      "type": "pokemon",
      "x": 1250,
      "y": 810,
      "z_layer": 2,
      "scale": 130
    },
    {
      "asset_id": "npc:villager-b",
      "type": "npc",
      "x": 1400,
      "y": 770,
      "z_layer": 2,
      "scale": 150
    },
    {
      "asset_id": "npc:trainer",
      "type": "npc",
      "x": 1850,
      "y": 800,
      "z_layer": 2,
      "scale": 160
    },
    {
      "asset_id": "pokemon:172",
      "type": "pokemon",
      "x": 1950,
      "y": 830,
      "z_layer": 2,
      "scale": 90
    },
    {
      "asset_id": "npc:villager-c",
      "type": "npc",
      "x": 2100,
      "y": 760,
      "z_layer": 2,
      "scale": 150
    },
    {
      "asset_id": "pokemon:183",
      "type": "pokemon",
      "x": 2200,
      "y": 790,
      "z_layer": 2,
      "scale": 120
    },
    {
      "asset_id": "npc:vendor",
      "type": "npc",
      "x": 2450,
      "y": 770,
      "z_layer": 2,
      "scale": 170
    },
    {
      "asset_id": "pokemon:98",
      "type": "pokemon",
      "x": 2600,
      "y": 820,
      "z_layer": 2,
      "scale": 110
    },
    {
      "asset_id": "npc:villager-d",
      "type": "npc",
      "x": 2800,
      "y": 780,
      "z_layer": 2,
      "scale": 150
    },
    {
      "asset_id": "pokemon:132",
      "type": "pokemon",
      "x": 2950,
      "y": 810,
      "z_layer": 2,
      "scale": 120
    },
    {
      "asset_id": "npc:fisher",
      "type": "npc",
      "x": 2750,
      "y": 840,
      "z_layer": 2,
      "scale": 160
    },
    {
      "asset_id": "pokemon:43",
      "type": "pokemon",
      "x": 850,
      "y": 850,
      "z_layer": 2,
      "scale": 100
    },
    {
      "asset_id": "prop:crate",
      "type": "prop",
      "x": 1150,
      "y": 860,
      "z_layer": 3,
      "scale": 120
    },
    {
      "asset_id": "prop:barrel",
      "type": "prop",
      "x": 1300,
      "y": 880,
      "z_layer": 3,
      "scale": 100
    },
    {
      "asset_id": "prop:net",
      "type": "prop",
      "x": 400,
      "y": 820,
      "z_layer": 3,
      "scale": 140
    },
    {
      "asset_id": "prop:bench",
      "type": "prop",
      "x": 2000,
      "y": 900,
      "z_layer": 3,
      "scale": 180
    },
    {
      "asset_id": "prop:crate",
      "type": "prop",
      "x": 2650,
      "y": 870,
      "z_layer": 3,
      "scale": 110
    },
    {
      "asset_id": "prop:barrel",
      "type": "prop",
      "x": 2900,
      "y": 890,
      "z_layer": 3,
      "scale": 90
    },
    {
      "asset_id": "prop:lamppost",
      "type": "prop",
      "x": 1550,
      "y": 844.0,
      "z_layer": 4,
      "scale": 130
    }
  ],
  "hint_text": "Look in the deep blue water near the center boats!",
  "math_hook": {
    "skill": "add",
    "max": 12
  }
}
