{
  "id": "gym-t3-lucario",
  "theme": "gym",
  "difficulty": 3,
  "canvas": {
    "w": 3200,
    "h": 1000
  },
  "target": {
    "species": 448,
    "x": 1650,
    "y": 820,
    "scale": 140,
    "bbox": [
      1580,
      750,
      140,
      140
    ],
    "occlusion_pct": 12
  },
  "decoys": [
    {
      "species": 197,
      "x": 1480,
      "y": 830,
      "scale": 130,
      "flip": true
    },
    {
      "species": 58,
      "x": 1780,
      "y": 810,
      "scale": 125
    },
    {
      "species": 133,
      "x": 1550,
      "y": 850,
      "scale": 110
    },
    {
      "species": 58,
      "x": 1720,
      "y": 860,
      "scale": 115,
      "flip": true
    }
  ],
  "entities": [
    {
      "asset_id": "pokemon:12",
      "type": "pokemon",
      "x": 300,
      "y": 200,
      "z_layer": 0,
      "scale": 90
    },
    {
      "asset_id": "pokemon:16",
      "type": "pokemon",
      "x": 2800,
      "y": 210,
      "z_layer": 0,
      "scale": 85,
      "flip": true
    },
    {
      "asset_id": "pokemon:778",
      "type": "pokemon",
      "x": 1600,
      "y": 220,
      "z_layer": 0,
      "scale": 100
    },
    {
      "asset_id": "prop:gym-sign",
      "type": "prop",
      "x": 400,
      "y": 350,
      "z_layer": 1,
      "scale": 350
    },
    {
      "asset_id": "prop:crate",
      "type": "prop",
      "x": 2900,
      "y": 400,
      "z_layer": 1,
      "scale": 180
    },
    {
      "asset_id": "npc:trainer",
      "type": "npc",
      "x": 600,
      "y": 550,
      "z_layer": 1,
      "scale": 160
    },
    {
      "asset_id": "pokemon:25",
      "type": "pokemon",
      "x": 1200,
      "y": 600,
      "z_layer": 1,
      "scale": 140
    },
    {
      "asset_id": "pokemon:197",
      "type": "pokemon",
      "x": 2400,
      "y": 620,
      "z_layer": 1,
      "scale": 150,
      "flip": true
    },
    {
      "asset_id": "npc:villager-a",
      "type": "npc",
      "x": 800,
      "y": 720,
      "z_layer": 2,
      "scale": 130
    },
    {
      "asset_id": "pokemon:58",
      "type": "pokemon",
      "x": 1100,
      "y": 740,
      "z_layer": 2,
      "scale": 120
    },
    {
      "asset_id": "pokemon:133",
      "type": "pokemon",
      "x": 450,
      "y": 760,
      "z_layer": 2,
      "scale": 110
    },
    {
      "asset_id": "npc:villager-b",
      "type": "npc",
      "x": 2600,
      "y": 750,
      "z_layer": 2,
      "scale": 140,
      "flip": true
    },
    {
      "asset_id": "pokemon:19",
      "type": "pokemon",
      "x": 3000,
      "y": 780,
      "z_layer": 2,
      "scale": 100
    },
    {
      "asset_id": "pokemon:133",
      "type": "pokemon",
      "x": 900,
      "y": 800,
      "z_layer": 2,
      "scale": 105
    },
    {
      "asset_id": "npc:vendor",
      "type": "npc",
      "x": 2100,
      "y": 790,
      "z_layer": 2,
      "scale": 150
    },
    {
      "asset_id": "pokemon:778",
      "type": "pokemon",
      "x": 1350,
      "y": 810,
      "z_layer": 2,
      "scale": 125
    },
    {
      "asset_id": "pokemon:197",
      "type": "pokemon",
      "x": 1900,
      "y": 820,
      "z_layer": 2,
      "scale": 135,
      "flip": true
    },
    {
      "asset_id": "npc:villager-c",
      "type": "npc",
      "x": 550,
      "y": 830,
      "z_layer": 2,
      "scale": 130
    },
    {
      "asset_id": "pokemon:58",
      "type": "pokemon",
      "x": 2750,
      "y": 840,
      "z_layer": 2,
      "scale": 115
    },
    {
      "asset_id": "pokemon:133",
      "type": "pokemon",
      "x": 2300,
      "y": 850,
      "z_layer": 2,
      "scale": 110
    },
    {
      "asset_id": "npc:villager-d",
      "type": "npc",
      "x": 1050,
      "y": 860,
      "z_layer": 2,
      "scale": 125
    },
    {
      "asset_id": "prop:bench",
      "type": "prop",
      "x": 320,
      "y": 880,
      "z_layer": 3,
      "scale": 280
    },
    {
      "asset_id": "prop:bench",
      "type": "prop",
      "x": 2950,
      "y": 890,
      "z_layer": 3,
      "scale": 260
    },
    {
      "asset_id": "prop:crate",
      "type": "prop",
      "x": 1600,
      "y": 900,
      "z_layer": 3,
      "scale": 100
    },
    {
      "asset_id": "prop:crate",
      "type": "prop",
      "x": 1780,
      "y": 905,
      "z_layer": 3,
      "scale": 95
    },
    {
      "asset_id": "prop:rock",
      "type": "prop",
      "x": 850,
      "y": 910,
      "z_layer": 3,
      "scale": 140
    },
    {
      "asset_id": "prop:rock",
      "type": "prop",
      "x": 2200,
      "y": 915,
      "z_layer": 3,
      "scale": 130
    }
  ],
  "hint_text": "Look near the benches in the middle of the gym floor!",
  "density": {
    "crowd": 24,
    "total": 32
  }
}
