{
  "id": "meadow-t2-chikorita",
  "theme": "meadow",
  "difficulty": 2,
  "canvas": {
    "w": 3200,
    "h": 1000
  },
  "target": {
    "species": 152,
    "x": 1580,
    "y": 720,
    "scale": 130,
    "bbox": [
      1515,
      655,
      130,
      130
    ],
    "occlusion_pct": 0
  },
  "decoys": [
    {
      "species": 1,
      "x": 1280,
      "y": 740,
      "scale": 140
    },
    {
      "species": 191,
      "x": 1720,
      "y": 710,
      "scale": 100
    },
    {
      "species": 43,
      "x": 1650,
      "y": 800,
      "scale": 90
    }
  ],
  "entities": [
    {
      "asset_id": "prop:tree-round",
      "type": "prop",
      "x": 350,
      "y": 280,
      "z_layer": 0,
      "scale": 300
    },
    {
      "asset_id": "prop:bush",
      "type": "prop",
      "x": 2850,
      "y": 290,
      "z_layer": 0,
      "scale": 200
    },
    {
      "asset_id": "pokemon:16",
      "type": "pokemon",
      "x": 650,
      "y": 230,
      "z_layer": 0,
      "scale": 100
    },
    {
      "asset_id": "pokemon:12",
      "type": "pokemon",
      "x": 2450,
      "y": 250,
      "z_layer": 0,
      "scale": 110
    },
    {
      "asset_id": "prop:flowerbed",
      "type": "prop",
      "x": 150,
      "y": 550,
      "z_layer": 1,
      "scale": 250
    },
    {
      "asset_id": "prop:rock",
      "type": "prop",
      "x": 2900,
      "y": 600,
      "z_layer": 1,
      "scale": 120
    },
    {
      "asset_id": "pokemon:189",
      "type": "pokemon",
      "x": 500,
      "y": 490,
      "z_layer": 1,
      "scale": 90
    },
    {
      "asset_id": "pokemon:187",
      "type": "pokemon",
      "x": 2650,
      "y": 520,
      "z_layer": 1,
      "scale": 85
    },
    {
      "asset_id": "npc:trainer",
      "type": "npc",
      "x": 800,
      "y": 700,
      "z_layer": 2,
      "scale": 160
    },
    {
      "asset_id": "pokemon:1",
      "type": "pokemon",
      "x": 1100,
      "y": 750,
      "z_layer": 2,
      "scale": 130
    },
    {
      "asset_id": "pokemon:25",
      "type": "pokemon",
      "x": 450,
      "y": 820,
      "z_layer": 2,
      "scale": 110
    },
    {
      "asset_id": "pokemon:19",
      "type": "pokemon",
      "x": 950,
      "y": 880,
      "z_layer": 2,
      "scale": 90
    },
    {
      "asset_id": "npc:villager-a",
      "type": "npc",
      "x": 1050,
      "y": 800,
      "z_layer": 2,
      "scale": 150
    },
    {
      "asset_id": "pokemon:175",
      "type": "pokemon",
      "x": 1500,
      "y": 850,
      "z_layer": 2,
      "scale": 80
    },
    {
      "asset_id": "npc:villager-b",
      "type": "npc",
      "x": 1800,
      "y": 760,
      "z_layer": 2,
      "scale": 155
    },
    {
      "asset_id": "pokemon:52",
      "type": "pokemon",
      "x": 2100,
      "y": 810,
      "z_layer": 2,
      "scale": 100
    },
    {
      "asset_id": "npc:vendor",
      "type": "npc",
      "x": 2400,
      "y": 780,
      "z_layer": 2,
      "scale": 165
    },
    {
      "asset_id": "pokemon:152",
      "type": "pokemon",
      "x": 2000,
      "y": 900,
      "z_layer": 2,
      "scale": 95
    },
    {
      "asset_id": "prop:bush",
      "type": "prop",
      "x": 1580,
      "y": 920,
      "z_layer": 3,
      "scale": 180
    },
    {
      "asset_id": "prop:bench",
      "type": "prop",
      "x": 500,
      "y": 940,
      "z_layer": 3,
      "scale": 200
    }
  ],
  "hint_text": "Look for the green leafy friend hiding near the big flower bush!"
}
