{
  "id": "harbor-t2-squirtle",
  "theme": "harbor",
  "difficulty": 2,
  "canvas": { "w": 3200, "h": 1000 },
  "target": {
    "species": 7,
    "x": 1980,
    "y": 760,
    "scale": 120,
    "bbox": [1920, 700, 120, 120],
    "occlusion_pct": 0
  },
  "decoys": [
    { "species": 8, "x": 1720, "y": 750, "scale": 140 },
    { "species": 9, "x": 2260, "y": 790, "scale": 170, "flip": true },
    { "species": 60, "x": 2050, "y": 880, "scale": 110 }
  ],
  "entities": [
    { "asset_id": "pokemon:16", "type": "pokemon", "x": 420, "y": 200, "z_layer": 0, "scale": 110 },
    { "asset_id": "pokemon:12", "type": "pokemon", "x": 2880, "y": 210, "z_layer": 0, "scale": 120, "flip": true },
    { "asset_id": "prop:boat-sail", "type": "prop", "x": 750, "y": 430, "z_layer": 1, "scale": 300 },
    { "asset_id": "prop:lighthouse", "type": "prop", "x": 3060, "y": 420, "z_layer": 1, "scale": 240 },
    { "asset_id": "prop:boat-small", "type": "prop", "x": 2150, "y": 570, "z_layer": 1, "scale": 220 },
    { "asset_id": "pokemon:130", "type": "pokemon", "x": 600, "y": 470, "z_layer": 1, "scale": 260 },
    { "asset_id": "pokemon:131", "type": "pokemon", "x": 1450, "y": 520, "z_layer": 1, "scale": 220, "flip": true },
    { "asset_id": "pokemon:87", "type": "pokemon", "x": 950, "y": 570, "z_layer": 1, "scale": 180 },
    { "asset_id": "pokemon:129", "type": "pokemon", "x": 2550, "y": 560, "z_layer": 1, "scale": 120 },
    { "asset_id": "npc:fisher", "type": "npc", "x": 500, "y": 690, "z_layer": 2, "scale": 160 },
    { "asset_id": "pokemon:54", "type": "pokemon", "x": 800, "y": 800, "z_layer": 2, "scale": 130 },
    { "asset_id": "pokemon:25", "type": "pokemon", "x": 1250, "y": 860, "z_layer": 2, "scale": 130, "flip": true },
    { "asset_id": "npc:vendor", "type": "npc", "x": 2450, "y": 740, "z_layer": 2, "scale": 170 },
    { "asset_id": "pokemon:79", "type": "pokemon", "x": 3000, "y": 790, "z_layer": 2, "scale": 150 },
    { "asset_id": "pokemon:98", "type": "pokemon", "x": 2650, "y": 900, "z_layer": 3, "scale": 110 },
    { "asset_id": "prop:crate", "type": "prop", "x": 2480, "y": 830, "z_layer": 3, "scale": 110 },
    { "asset_id": "prop:barrel", "type": "prop", "x": 1050, "y": 870, "z_layer": 3, "scale": 100 },
    { "asset_id": "prop:bench", "type": "prop", "x": 2870, "y": 930, "z_layer": 3, "scale": 180 }
  ],
  "density": { "crowd": 16, "total": 22 },
  "hint_text": "Look on the pier, next to the big blue turtles!"
}
